{"protocol":"G3-ATOMIC-RIVER-AUDIT-v1","pairId":"PAIR-KIT-RIVER","judgeSlot":"SOL-ULTRA","cells":[{"cellId":"R01","singleCompositionUnit":true,"containsWholeRiverOrMap":false,"containsAtlasOrAlternatives":false,"evidenceBox":[29,150,240,309],"observation":"One continuous dark blue-gray material tile."},{"cellId":"R02","singleCompositionUnit":true,"containsWholeRiverOrMap":false,"containsAtlasOrAlternatives":false,"evidenceBox":[272,150,484,309],"observation":"One continuous brown material tile."},{"cellId":"R03","singleCompositionUnit":true,"containsWholeRiverOrMap":false,"containsAtlasOrAlternatives":false,"evidenceBox":[515,150,726,309],"observation":"One continuous brighter blue-gray material tile."},{"cellId":"R04","singleCompositionUnit":true,"containsWholeRiverOrMap":false,"containsAtlasOrAlternatives":false,"evidenceBox":[760,143,969,313],"observation":"One compact rectangular masonry unit."},{"cellId":"R05","singleCompositionUnit":true,"containsWholeRiverOrMap":false,"containsAtlasOrAlternatives":false,"evidenceBox":[29,456,239,620],"observation":"One straight raised stone-bank unit."},{"cellId":"R06","singleCompositionUnit":true,"containsWholeRiverOrMap":false,"containsAtlasOrAlternatives":false,"evidenceBox":[291,429,464,643],"observation":"One broad curved masonry-bank unit."},{"cellId":"R07","singleCompositionUnit":true,"containsWholeRiverOrMap":false,"containsAtlasOrAlternatives":false,"evidenceBox":[530,429,709,643],"observation":"One narrow curved raised-bank unit."},{"cellId":"R08","singleCompositionUnit":true,"containsWholeRiverOrMap":false,"containsAtlasOrAlternatives":false,"evidenceBox":[794,429,936,643],"observation":"One hooked curved bank unit."},{"cellId":"R09","singleCompositionUnit":true,"containsWholeRiverOrMap":false,"containsAtlasOrAlternatives":false,"evidenceBox":[60,736,212,943],"observation":"One curved rubble-bank unit."},{"cellId":"R10","singleCompositionUnit":true,"containsWholeRiverOrMap":false,"containsAtlasOrAlternatives":false,"evidenceBox":[310,736,446,940],"observation":"One masonry gate-like abutment unit."},{"cellId":"R11","singleCompositionUnit":true,"containsWholeRiverOrMap":false,"containsAtlasOrAlternatives":false,"evidenceBox":[516,758,725,942],"observation":"One straight cobbled-bank unit."},{"cellId":"R12","singleCompositionUnit":true,"containsWholeRiverOrMap":false,"containsAtlasOrAlternatives":false,"evidenceBox":[763,742,967,940],"observation":"One sparse cluster of ripple arcs and foam flecks."}],"map":{"largeBakedRiverRasterPresent":false,"evidenceBoxes":[[235,345,674,626]],"observation":"The channel has repeated water material with separately visible edge and crossing elements."},"states":{"normalWaterVisible":true,"heatIsNarrowerAndDrier":true,"floodIsWiderAndWetter":true,"evidenceBoxes":[[235,345,674,626],[235,345,674,626],[235,345,674,626]],"observation":"Normal is blue-gray, heat contracts to a brown trace, and flood expands bright blue under rain."},"criticalFailures":[],"verdict":"PASS"}